movieName,producerName,directorName,releaseYear,url
Harry Potter and the Deathly Hallows – Part 1,David Heyman,David Yates,2010,Harry Potter and the Deathly Hallows – Part 1
Harry Potter and the Deathly Hallows – Part 1,David Barron,David Yates,2010,Harry Potter and the Deathly Hallows – Part 1
Harry Potter and the Deathly Hallows – Part 2,David Heyman,David Yates,2011,Harry Potter and the Deathly Hallows – Part 2
Harry Potter and the Prisoner of Azkaban,David Heyman,Alfonso Cuarón,2004,Harry Potter and the Prisoner of Azkaban
Harry Potter and the Prisoner of Azkaban,Chris Columbus,Alfonso Cuarón,2004,Harry Potter and the Prisoner of Azkaban
Harry Potter and the Goblet of Fire,David Heyman,Mike Newell,2005,Harry Potter and the Goblet of Fire
Harry Potter and the Philosopher's Stone,David Heyman,Chris Columbus,2001,Harry Potter and the Philosopher's Stone
Harry Potter and the Order of the Phoenix,David Heyman,David Yates,2007,Harry Potter and the Order of the Phoenix
Harry Potter and the Half-Blood Prince,David Heyman,David Yates,2009,Harry Potter and the Half-Blood Prince
Harry Potter and the Chamber of Secrets,David Heyman,Chris Columbus,2002,Harry Potter and the Chamber of Secrets
